Sheet: Blad1
A1: OnePlus One
B4: Mobilt | G4: Wifi med Vpn RaspberryPI
B5: Ner | C5: Upp | D5: Svarstid | G5: Ner | H5: Upp | I5: Svarstid
A6: Webb 1:3 | B6: 44.51 | C6: 20.94 | D6: 36.53 | F6: Webb 1:3 | G6: 17 | H6: 23.59 | I6: 27.65
A7: Webb 2:3 | B7: 43.93 | C7: 12 | D7: 33.51 | F7: Webb 2:3 | G7: 16.75 | H7: 22.11 | I7: 21.45
A8: Webb 3:3 | B8: 49.22 | C8: 11.9 | D8: 29.25 | F8: Webb 3:3 | G8: 14.64 | H8: 24.59 | I8: 34.56
A9: App | B9: 45.37 | C9: 15.3 | D9: 30.9 | F9: App | G9: 21.7 | H9: 26.71 | I9: 111
A10: Snitt | B10: of:=SUM([.B6:.B9])/4 -> 45.7575 | C10: of:=SUM([.C6:.C9])/4 -> 15.035 | D10: of:=SUM([.D6:.D9])/4 -> 32.5475 | F10: Snitt | G10: of:=SUM([.G6:.G9])/4 -> 17.5225 | H10: of:=SUM([.H6:.H9])/4 -> 24.25 | I10: of:=SUM([.I6:.I9])/4 -> 48.665
A11: WebbSnitt | B11: of:=SUM([.B6:.B8])/3 -> 45.8866666666667 | C11: of:=SUM([.C6:.C8])/3 -> 14.9466666666667 | D11: of:=SUM([.D6:.D8])/3 -> 33.0966666666667 | F11: WebbSnitt | G11: of:=SUM([.G6:.G8])/3 -> 16.13 | H11: of:=SUM([.H6:.H8])/3 -> 23.43 | I11: of:=SUM([.I6:.I8])/3 -> 27.8866666666667
B13: Wifi | G13: Mobilt med Vpn ”snabb”
B14: Ner | C14: Upp | D14: Svarstid | G14: Ner | H14: Upp | I14: Svarstid
A15: Webb 1:3 | B15: 42.12 | C15: 29.98 | D15: 17.13 | F15: Webb 1:3 | G15: 17.46 | H15: 11.21 | I15: 61.34
A16: Webb 2:3 | B16: 25.29 | C16: 36.19 | D16: 35.56 | F16: Webb 2:3 | G16: 16.45 | H16: 9.67 | I16: 61.43
A17: Webb 3:3 | B17: 39.2 | C17: 42.03 | D17: 20.09 | F17: Webb 3:3 | G17: 17.89 | H17: 9.02 | I17: 60.68
A18: App | B18: 27.81 | C18: 37.84 | D18: 8 | F18: App | G18: 27.59 | H18: 20.86 | I18: 62
A19: Snitt | B19: of:=SUM([.B15:.B18])/4 -> 33.605 | C19: of:=SUM([.C15:.C18])/4 -> 36.51 | D19: of:=SUM([.D15:.D18])/4 -> 20.195 | F19: Snitt | G19: of:=SUM([.G15:.G18])/4 -> 19.8475 | H19: of:=SUM([.H15:.H18])/4 -> 12.69 | I19: of:=SUM([.I15:.I18])/4 -> 61.3625
A20: WebbSnitt | B20: of:=SUM([.B15:.B17])/3 -> 35.5366666666667 | C20: of:=SUM([.C15:.C17])/3 -> 36.0666666666667 | D20: of:=SUM([.D15:.D17])/3 -> 24.26 | F20: WebbSnitt | G20: of:=SUM([.G15:.G17])/3 -> 17.2666666666667 | H20: of:=SUM([.H15:.H17])/3 -> 9.96666666666667 | I20: of:=SUM([.I15:.I17])/3 -> 61.15
B22: Mobilt med Vpn RaspberryPI | G22: Wifi med Vpn ”snabb”
B23: Ner | C23: Upp | D23: Svarstid | G23: Ner | H23: Upp | I23: Svarstid
A24: Webb 1:3 | B24: 14.12 | C24: 4.19 | D24: 64.37 | F24: Webb 1:3 | G24: 21.46 | H24: 33.79 | I24: 19.5
A25: Webb 2:3 | B25: 15.52 | C25: 3.78 | D25: 62.02 | F25: Webb 2:3 | G25: 22.54 | H25: 29.03 | I25: 18.99
A26: Webb 3:3 | B26: 14.5 | C26: 3.7 | D26: 66.04 | F26: Webb 3:3 | G26: 18.69 | H26: 24.81 | I26: 17.29
A27: App | B27: 26.89 | C27: 25.29 | D27: 55 | F27: App | G27: 30.41 | H27: 22.27 | I27: 60
A28: Snitt | B28: of:=SUM([.B24:.B27])/4 -> 17.7575 | C28: of:=SUM([.C24:.C27])/4 -> 9.24 | D28: of:=SUM([.D24:.D27])/4 -> 61.8575 | F28: Snitt | G28: of:=SUM([.G24:.G27])/4 -> 23.275 | H28: of:=SUM([.H24:.H27])/4 -> 27.475 | I28: of:=SUM([.I24:.I27])/4 -> 28.945
A29: WebbSnitt | B29: of:=SUM([.B24:.B26])/3 -> 14.7133333333333 | C29: of:=SUM([.C24:.C26])/3 -> 3.89 | D29: of:=SUM([.D24:.D26])/3 -> 64.1433333333333 | F29: WebbSnitt | G29: of:=SUM([.G24:.G26])/3 -> 20.8966666666667 | H29: of:=SUM([.H24:.H26])/3 -> 29.21 | I29: of:=SUM([.I24:.I26])/3 -> 18.5933333333333
C33: Ner | D33: Upp | E33: Svarstid
A34: Mobilt | C34: of:=[.B10] -> 45.7575 | D34: of:=[.C10] -> 15.035 | E34: of:=[.D10] -> 32.5475
A35: Wifi | C35: of:=[.B19] -> 33.605 | D35: of:=[.C19] -> 36.51 | E35: of:=[.D19] -> 20.195
A36: Mobilt VPN PI | C36: of:=[.B28] -> 17.7575 | D36: of:=[.C28] -> 9.24 | E36: of:=[.D28] -> 61.8575
A37: Wifi VPN Pi | C37: of:=[.G10] -> 17.5225 | D37: of:=[.H10] -> 24.25 | E37: of:=[.I10] -> 48.665
A38: Mobilt VPN ”snabb” | C38: of:=[.G19] -> 19.8475 | D38: of:=[.H19] -> 12.69 | E38: of:=[.I19] -> 61.3625
A39: Wifi VPN ”snabb” | C39: of:=[.G28] -> 23.275 | D39: of:=[.H28] -> 27.475 | E39: of:=[.I28] -> 28.945
A40: 3:Mobilt | C40: of:=[.B11] -> 45.8866666666667 | D40: of:=[.C11] -> 14.9466666666667 | E40: of:=[.D11] -> 33.0966666666667
A41: 3:Wifi | C41: of:=[.B20] -> 35.5366666666667 | D41: of:=[.C20] -> 36.0666666666667 | E41: of:=[.D20] -> 24.26
A42: 3:Mobilt VPN PI | C42: of:=[.B29] -> 14.7133333333333 | D42: of:=[.C29] -> 3.89 | E42: of:=[.D29] -> 64.1433333333333
A43: 3:Wifi VPN Pi | C43: of:=[.G11] -> 16.13 | D43: of:=[.H11] -> 23.43 | E43: of:=[.I11] -> 27.8866666666667
A44: 3:Mobilt VPN ”snabb” | C44: of:=[.G20] -> 17.2666666666667 | D44: of:=[.H20] -> 9.96666666666667 | E44: of:=[.I20] -> 61.15
A45: 3:Wifi VPN ”snabb” | C45: of:=[.G29] -> 20.8966666666667 | D45: of:=[.H29] -> 29.21 | E45: of:=[.I29] -> 18.5933333333333
A54: Samsung S8
B57: Mobilt | G57: Wifi med Vpn RaspberryPI
B58: Ner | C58: Upp | D58: Svarstid | G58: Ner | H58: Upp | I58: Svarstid
A59: Webb 1:3 | B59: 33.78 | C59: 8.79 | D59: 32.25 | F59: Webb 1:3 | G59: 34.85 | H59: 53.04 | I59: 15.87
A60: Webb 2:3 | B60: 28.6 | C60: 8.37 | D60: 125.69 | F60: Webb 2:3 | G60: 32 | H60: 30.37 | I60: 15.06
A61: Webb 3:3 | B61: 29.7 | C61: 4.15 | D61: 37.11 | F61: Webb 3:3 | G61: 33.92 | H61: 32.52 | I61: 15.37
A62: App | B62: 126.03 | C62: 9.81 | D62: 37 | F62: App | G62: 45.22 | H62: 40.01 | I62: 15
A63: Snitt | B63: of:=SUM([.B59:.B62])/4 -> 54.5275 | C63: of:=SUM([.C59:.C62])/4 -> 7.78 | D63: of:=SUM([.D59:.D62])/4 -> 58.0125 | F63: Snitt | G63: of:=SUM([.G59:.G62])/4 -> 36.4975 | H63: of:=SUM([.H59:.H62])/4 -> 38.985 | I63: of:=SUM([.I59:.I62])/4 -> 15.325
A64: WebbSnitt | B64: of:=SUM([.B59:.B61])/3 -> 30.6933333333333 | C64: of:=SUM([.C59:.C61])/3 -> 7.10333333333333 | D64: of:=SUM([.D59:.D61])/3 -> 65.0166666666667 | F64: WebbSnitt | G64: of:=SUM([.G59:.G61])/3 -> 33.59 | H64: of:=SUM([.H59:.H61])/3 -> 38.6433333333333 | I64: of:=SUM([.I59:.I61])/3 -> 15.4333333333333
B66: Wifi | G66: Mobilt med Vpn ”snabb”
B67: Ner | C67: Upp | D67: Svarstid | G67: Ner | H67: Upp | I67: Svarstid
A68: Webb 1:3 | B68: 53.04 | C68: 56.48 | D68: 10.78 | F68: Webb 1:3 | G68: 17.92 | H68: 2.42 | I68: 58.24
A69: Webb 2:3 | B69: 54.77 | C69: 66.75 | D69: 14.59 | F69: Webb 2:3 | G69: 15.75 | H69: 3.73 | I69: 59.04
A70: Webb 3:3 | B70: 38.22 | C70: 36.47 | D70: 11.03 | F70: Webb 3:3 | G70: 18.36 | H70: 10.69 | I70: 57.04
A71: App | B71: 52.93 | C71: 59.87 | D71: 10 | F71: App | G71: 28.16 | H71: 3.13 | I71: 62
A72: Snitt | B72: of:=SUM([.B68:.B71])/4 -> 49.74 | C72: of:=SUM([.C68:.C71])/4 -> 54.8925 | D72: of:=SUM([.D68:.D71])/4 -> 11.6 | F72: Snitt | G72: of:=SUM([.G68:.G71])/4 -> 20.0475 | H72: of:=SUM([.H68:.H71])/4 -> 4.9925 | I72: of:=SUM([.I68:.I71])/4 -> 59.08
A73: WebbSnitt | B73: of:=SUM([.B68:.B70])/3 -> 48.6766666666667 | C73: of:=SUM([.C68:.C70])/3 -> 53.2333333333333 | D73: of:=SUM([.D68:.D70])/3 -> 12.1333333333333 | F73: WebbSnitt | G73: of:=SUM([.G68:.G70])/3 -> 17.3433333333333 | H73: of:=SUM([.H68:.H70])/3 -> 5.61333333333333 | I73: of:=SUM([.I68:.I70])/3 -> 58.1066666666667
B75: Mobilt med Vpn RaspberryPI | G75: Wifi med Vpn ”snabb”
B76: Ner | C76: Upp | D76: Svarstid | G76: Ner | H76: Upp | I76: Svarstid
A77: Webb 1:3 | B77: 14.71 | C77: 10.87 | D77: 57.26 | F77: Webb 1:3 | G77: 39.28 | H77: 36.43 | I77: 14.68
A78: Webb 2:3 | B78: 13.25 | C78: 4.06 | D78: 60.39 | F78: Webb 2:3 | G78: 28.77 | H78: 31.8 | I78: 13.91
A79: Webb 3:3 | B79: 14.13 | C79: 10.18 | D79: 67.57 | F79: Webb 3:3 | G79: 30.64 | H79: 34.34 | I79: 13.69
A80: App | B80: 21.02 | C80: 9.66 | D80: 59 | F80: App | G80: 40.95 | H80: 45.49 | I80: 11
A81: Snitt | B81: of:=SUM([.B77:.B80])/4 -> 15.7775 | C81: of:=SUM([.C77:.C80])/4 -> 8.6925 | D81: of:=SUM([.D77:.D80])/4 -> 61.055 | F81: Snitt | G81: of:=SUM([.G77:.G80])/4 -> 34.91 | H81: of:=SUM([.H77:.H80])/4 -> 37.015 | I81: of:=SUM([.I77:.I80])/4 -> 13.32
A82: WebbSnitt | B82: of:=SUM([.B77:.B79])/3 -> 14.03 | C82: of:=SUM([.C77:.C79])/3 -> 8.37 | D82: of:=SUM([.D77:.D79])/3 -> 61.74 | F82: WebbSnitt | G82: of:=SUM([.G77:.G79])/3 -> 32.8966666666667 | H82: of:=SUM([.H77:.H79])/3 -> 34.19 | I82: of:=SUM([.I77:.I79])/3 -> 14.0933333333333
C86: Ner | D86: Upp | E86: Svarstid
A87: Mobilt | C87: of:=[.B63] -> 54.5275 | D87: of:=[.C63] -> 7.78 | E87: of:=[.D63] -> 58.0125
A88: Wifi | C88: of:=[.B72] -> 49.74 | D88: of:=[.C72] -> 54.8925 | E88: of:=[.D72] -> 11.6
A89: Mobilt VPN PI | C89: of:=[.B81] -> 15.7775 | D89: of:=[.C81] -> 8.6925 | E89: of:=[.D81] -> 61.055
A90: Wifi VPN Pi | C90: of:=[.G63] -> 36.4975 | D90: of:=[.H63] -> 38.985 | E90: of:=[.I63] -> 15.325
A91: Mobilt VPN ”snabb” | C91: of:=[.G72] -> 20.0475 | D91: of:=[.H72] -> 4.9925 | E91: of:=[.I72] -> 59.08
A92: Wifi VPN ”snabb” | C92: of:=[.G81] -> 34.91 | D92: of:=[.H81] -> 37.015 | E92: of:=[.I81] -> 13.32
A93: 3:Mobilt | C93: of:=[.B64] -> 30.6933333333333 | D93: of:=[.C64] -> 7.10333333333333 | E93: of:=[.D64] -> 65.0166666666667
A94: 3:Wifi | C94: of:=[.B73] -> 48.6766666666667 | D94: of:=[.C73] -> 53.2333333333333 | E94: of:=[.D73] -> 12.1333333333333
A95: 3:Mobilt VPN PI | C95: of:=[.B82] -> 14.03 | D95: of:=[.C82] -> 8.37 | E95: of:=[.D82] -> 61.74
A96: 3:Wifi VPN Pi | C96: of:=[.G64] -> 33.59 | D96: of:=[.H64] -> 38.6433333333333 | E96: of:=[.I64] -> 15.4333333333333
A97: 3:Mobilt VPN ”snabb” | C97: of:=[.G73] -> 17.3433333333333 | D97: of:=[.H73] -> 5.61333333333333 | E97: of:=[.I73] -> 58.1066666666667
A98: 3:Wifi VPN ”snabb” | C98: of:=[.G82] -> 32.8966666666667 | D98: of:=[.H82] -> 34.19 | E98: of:=[.I82] -> 14.0933333333333
A107: Samsung J5-16
B110: Mobilt | G110: Wifi med Vpn RaspberryPI
B111: Ner | C111: Upp | D111: Svarstid | G111: Ner | H111: Upp | I111: Svarstid
B112: n/a | C112: n/a | D112: n/a | F112: Webb 1:3 | G112: 15.55 | H112: 18.43 | I112: 18.63
B113: n/a | C113: n/a | D113: n/a | F113: Webb 2:3 | G113: 17.21 | H113: 19.57 | I113: 16.99
B114: n/a | C114: n/a | D114: n/a | F114: Webb 3:3 | G114: 14.71 | H114: 18.49 | I114: 20.25
B115: n/a | C115: n/a | D115: n/a | F115: App | G115: 21.07 | H115: 32.85 | I115: 10
A116: Snitt | B116: of:=SUM([.B112:.B115])/4 -> 0 | C116: of:=SUM([.C112:.C115])/4 -> 0 | D116: of:=SUM([.D112:.D115])/4 -> 0 | F116: Snitt | G116: of:=SUM([.G112:.G115])/4 -> 17.135 | H116: of:=SUM([.H112:.H115])/4 -> 22.335 | I116: of:=SUM([.I112:.I115])/4 -> 16.4675
F117: WebbSnitt | G117: of:=SUM([.G112:.G114])/3 -> 15.8233333333333 | H117: of:=SUM([.H112:.H114])/3 -> 18.83 | I117: of:=SUM([.I112:.I114])/3 -> 18.6233333333333
B119: Wifi | G119: Mobilt med Vpn ”snabb”
B120: Ner | C120: Upp | D120: Svarstid | G120: Ner | H120: Upp | I120: Svarstid
A121: Webb 1:3 | B121: 32.59 | C121: 35.55 | D121: 33.21 | G121: n/a | H121: n/a | I121: n/a
A122: Webb 2:3 | B122: 27.11 | C122: 32.71 | D122: 56.05 | G122: n/a | H122: n/a | I122: n/a
A123: Webb 3:3 | B123: 30.77 | C123: 28.93 | D123: 15.24 | G123: n/a | H123: n/a | I123: n/a
A124: App | B124: 27.79 | C124: 49.88 | D124: 8 | G124: n/a | H124: n/a | I124: n/a
A125: Snitt | B125: of:=SUM([.B121:.B124])/4 -> 29.565 | C125: of:=SUM([.C121:.C124])/4 -> 36.7675 | D125: of:=SUM([.D121:.D124])/4 -> 28.125 | F125: Snitt | G125: of:=SUM([.G121:.G124])/4 -> 0 | H125: of:=SUM([.H121:.H124])/4 -> 0 | I125: of:=SUM([.I121:.I124])/4 -> 0
A126: WebbSnitt | B126: of:=SUM([.B121:.B123])/3 -> 30.1566666666667 | C126: of:=SUM([.C121:.C123])/3 -> 32.3966666666667 | D126: of:=SUM([.D121:.D123])/3 -> 34.8333333333333
B128: Mobilt med Vpn RaspberryPI | G128: Wifi med Vpn ”snabb”
B129: Ner | C129: Upp | D129: Svarstid | G129: Ner | H129: Upp | I129: Svarstid
B130: n/a | C130: n/a | D130: n/a | F130: Webb 1:3 | G130: 17.64 | H130: 20.58 | I130: 13.06
B131: n/a | C131: n/a | D131: n/a | F131: Webb 2:3 | G131: 13.66 | H131: 17.72 | I131: 28.82
B132: n/a | C132: n/a | D132: n/a | F132: Webb 3:3 | G132: 18.46 | H132: 23.54 | I132: 27.81
B133: n/a | C133: n/a | D133: n/a | F133: App | G133: 22.53 | H133: 34.09 | I133: 10
A134: Snitt | B134: of:=SUM([.B130:.B133])/4 -> 0 | C134: of:=SUM([.C130:.C133])/4 -> 0 | D134: of:=SUM([.D130:.D133])/4 -> 0 | F134: Snitt | G134: of:=SUM([.G130:.G133])/4 -> 18.0725 | H134: of:=SUM([.H130:.H133])/4 -> 23.9825 | I134: of:=SUM([.I130:.I133])/4 -> 19.9225
F135: WebbSnitt | G135: of:=SUM([.G130:.G132])/3 -> 16.5866666666667 | H135: of:=SUM([.H130:.H132])/3 -> 20.6133333333333 | I135: of:=SUM([.I130:.I132])/3 -> 23.23
C139: Ner | D139: Upp | E139: Svarstid
A140: Mobilt | C140: of:=[.B116] -> 0 | D140: of:=[.C116] -> 0 | E140: of:=[.D116] -> 0
A141: Wifi | C141: of:=[.B125] -> 29.565 | D141: of:=[.C125] -> 36.7675 | E141: of:=[.D125] -> 28.125
A142: Mobilt VPN PI | C142: of:=[.B134] -> 0 | D142: of:=[.C134] -> 0 | E142: of:=[.D134] -> 0
A143: Wifi VPN Pi | C143: of:=[.G116] -> 17.135 | D143: of:=[.H116] -> 22.335 | E143: of:=[.I116] -> 16.4675
A144: Mobilt VPN ”snabb” | C144: of:=[.G125] -> 0 | D144: of:=[.H125] -> 0 | E144: of:=[.I125] -> 0
A145: Wifi VPN ”snabb” | C145: of:=[.G134] -> 18.0725 | D145: of:=[.H134] -> 23.9825 | E145: of:=[.I134] -> 19.9225
A146: 3:Mobilt | C146: of:=[.B117] -> 0 | D146: of:=[.C117] -> 0 | E146: of:=[.D117] -> 0
A147: 3:Wifi | C147: of:=[.B126] -> 30.1566666666667 | D147: of:=[.C126] -> 32.3966666666667 | E147: of:=[.D126] -> 34.8333333333333
A148: 3:Mobilt VPN PI | C148: of:=[.B135] -> 0 | D148: of:=[.C135] -> 0 | E148: of:=[.D135] -> 0
A149: 3:Wifi VPN Pi | C149: of:=[.G117] -> 15.8233333333333 | D149: of:=[.H117] -> 18.83 | E149: of:=[.I117] -> 18.6233333333333
A150: 3:Mobilt VPN ”snabb” | C150: of:=[.G126] -> 0 | D150: of:=[.H126] -> 0 | E150: of:=[.I126] -> 0
A151: 3:Wifi VPN ”snabb” | C151: of:=[.G135] -> 16.5866666666667 | D151: of:=[.H135] -> 20.6133333333333 | E151: of:=[.I135] -> 23.23